<?xml version="1.0" encoding="UTF-8"?>
<family_characteristic_table xmlns:xsi="http://www.w3.org/2001/XMLSchema-instance"
	xsi:noNamespaceSchemaLocation="../../validation/family-characteristic.xsd">
	<name>test_family_characteristic</name>
	<intervals>
		<interval>
			<lower_limit>1</lower_limit>
			<family_characteristic>
				<name>characteristic_1</name>
				<bonus>
					<skills>
						<skill>
							<name>skill_1</name>
							<value>3</value>
						</skill>
						<skill>
							<name>skill_2</name>
							<descriptor>descriptor_skill_2</descriptor>
							<value>4</value>
						</skill>
					</skills>
				</bonus>
			</family_characteristic>
		</interval>
		<interval>
			<lower_limit>5</lower_limit>
			<family_characteristic>
				<name>characteristic_2</name>
				<bonus>
					<attributes>
						<attribute>
							<name>appearance</name>
							<value>7</value>
						</attribute>
					</attributes>
					<skills>
						<skill>
							<name>skill_1</name>
							<value>3</value>
						</skill>
					</skills>
				</bonus>
			</family_characteristic>
		</interval>
	</intervals>
</family_characteristic_table>